{"annotations":[{"anchors":[{"anchor_id":"anchor:tan:john.13.8:no-share-with-me:1","anchor_order":1,"anchor_role":"primary","book_id":"john","chapter":13,"expected_phrase":"you have no part with me","scripture_package_content_sha256":"464933e34cf7e1e612da082d1d5c34309cea5e3cecf4657c2eb594f358c211f8","scripture_package_id":"engwebp-2020-2242945d71ca925b","utf16_length":24,"utf16_start":92,"verse":8,"verse_text_sha256":"e70d2a7975a39ef31f9ea9f206334c48f12970e02732356fa8db4f47b8e4bcd8"}],"annotation_issue_id":"tan:john.13.8:no-share-with-me","annotation_revision":2,"claim_reference_ids":["claim:john.13.8:no-share-with-me:1","claim:john.13.8:no-share-with-me:2","claim:john.13.8:no-share-with-me:3"],"editorial_state":"draft","eligibility":{"evaluation":{"authority_id":"J13-PILOT-01","basis_record_ids":["BSL-STUDY-JOHN-13-01-38-001","rap:tan:john.13.8:no-share-with-me"],"decision":"requires_review","limitations":["Pending separate evaluation authority, contamination review, and source verification."]},"public_sharing":{"authority_id":"J13-PILOT-01","basis_record_ids":["BSL-STUDY-JOHN-13-01-38-001","rap:tan:john.13.8:no-share-with-me"],"decision":"requires_review","limitations":["Pending owner approval and rights review of the exact reader prose."]},"reader_delivery":{"authority_id":"J13-PILOT-01","basis_record_ids":["BSL-STUDY-JOHN-13-01-38-001","rap:tan:john.13.8:no-share-with-me"],"decision":"requires_review","limitations":["Pending owner approval, Lab source and rights verification, and Biblos package compilation."]},"retrieval":{"authority_id":"J13-PILOT-01","basis_record_ids":["BSL-STUDY-JOHN-13-01-38-001","rap:tan:john.13.8:no-share-with-me"],"decision":"requires_review","limitations":["Pending owner approval and Lab verification of claim and source assertions."]},"training":{"authority_id":"UP-01-A01","basis_record_ids":["BSL-STUDY-JOHN-13-01-38-001","rap:tan:john.13.8:no-share-with-me"],"decision":"disallowed","limitations":["Training is disallowed by default. Separate owner, rights, source, and training authority would be required."]}},"full_note_paragraphs":["Jesus answers Peter’s refusal with οὐκ ἔχεις μέρος μετʼ ἐμοῦ, which WEB renders “you have no part with me.”","The noun μέρος can refer to a part, share, or portion. In this context, “no share with me” brings out participation with Jesus more clearly than “no part.”","Receiving Jesus’ washing is therefore presented as necessary for sharing with him. The phrase doesn’t, by itself, define every theological dimension of that participation."],"interpretive_limits":["The phrase doesn’t identify every theological dimension of Peter’s participation with Jesus.","It doesn’t by itself establish one final interpretation of baptism, regeneration, or continuing forgiveness."],"issue_category":"lexical_semantics","lifecycle_state":"active","scholarly_review_label":"model_assisted_editorial_review","short_note":"WEB says Peter would have “no part” with Jesus unless Jesus washed him. Greek μέρος can mean a part, share, or portion. “No share with me” makes the language of participation and belonging easier to hear.","source_reader_annotation_id":"rap:tan:john.13.8:no-share-with-me","source_reference_ids":["source:john.13.8:no-share-with-me:greek:1","source:john.13.8:no-share-with-me:morphology:2","source:john.13.8:no-share-with-me:english:3","source:john.13.8:no-share-with-me:lexicon:4"],"source_study_record_id":"BSL-STUDY-JOHN-13-01-38-001","source_verification_state":"verified","supersedes_revision":1},{"anchors":[{"anchor_id":"anchor:tan:john.13.10:bathed-versus-washed:1","anchor_order":1,"anchor_role":"primary","book_id":"john","chapter":13,"expected_phrase":"bathed","scripture_package_content_sha256":"464933e34cf7e1e612da082d1d5c34309cea5e3cecf4657c2eb594f358c211f8","scripture_package_id":"engwebp-2020-2242945d71ca925b","utf16_length":6,"utf16_start":36,"verse":10,"verse_text_sha256":"4ee5cab48e4cac2f2f0f3277f775b909bfc2bfdbf9db5a2ba8270738492b249d"},{"anchor_id":"anchor:tan:john.13.10:bathed-versus-washed:2","anchor_order":2,"anchor_role":"supporting","book_id":"john","chapter":13,"expected_phrase":"washed","scripture_package_content_sha256":"464933e34cf7e1e612da082d1d5c34309cea5e3cecf4657c2eb594f358c211f8","scripture_package_id":"engwebp-2020-2242945d71ca925b","utf16_length":6,"utf16_start":71,"verse":10,"verse_text_sha256":"4ee5cab48e4cac2f2f0f3277f775b909bfc2bfdbf9db5a2ba8270738492b249d"}],"annotation_issue_id":"tan:john.13.10:bathed-versus-washed","annotation_revision":2,"claim_reference_ids":["claim:john.13.10:bathed-versus-washed:1","claim:john.13.10:bathed-versus-washed:2","claim:john.13.10:bathed-versus-washed:3"],"editorial_state":"draft","eligibility":{"evaluation":{"authority_id":"J13-PILOT-01","basis_record_ids":["BSL-STUDY-JOHN-13-01-38-001","rap:tan:john.13.10:bathed-versus-washed"],"decision":"requires_review","limitations":["Pending separate evaluation authority, contamination review, and source verification."]},"public_sharing":{"authority_id":"J13-PILOT-01","basis_record_ids":["BSL-STUDY-JOHN-13-01-38-001","rap:tan:john.13.10:bathed-versus-washed"],"decision":"requires_review","limitations":["Pending owner approval and rights review of the exact reader prose."]},"reader_delivery":{"authority_id":"J13-PILOT-01","basis_record_ids":["BSL-STUDY-JOHN-13-01-38-001","rap:tan:john.13.10:bathed-versus-washed"],"decision":"requires_review","limitations":["Pending owner approval, Lab source and rights verification, and Biblos package compilation."]},"retrieval":{"authority_id":"J13-PILOT-01","basis_record_ids":["BSL-STUDY-JOHN-13-01-38-001","rap:tan:john.13.10:bathed-versus-washed"],"decision":"requires_review","limitations":["Pending owner approval and Lab verification of claim and source assertions."]},"training":{"authority_id":"UP-01-A01","basis_record_ids":["BSL-STUDY-JOHN-13-01-38-001","rap:tan:john.13.10:bathed-versus-washed"],"decision":"disallowed","limitations":["Training is disallowed by default. Separate owner, rights, source, and training authority would be required."]}},"full_note_paragraphs":["WEB says that someone who has “bathed” only needs the feet “washed.” Greek uses λελουμένος, from λούω, for the bath and νίπτω for washing the feet.","The wording distinguishes a whole bath from a local washing. The perfect participle identifies the person as already bathed, while the footwashing remains a separate act.","The lexical contrast is clear. The verse doesn’t by itself decide whether the bath represents baptism, initial cleansing, regeneration, or another theological category."],"interpretive_limits":["The two verbs don’t settle a complete sacramental theology.","The separate textual variant involving “except the feet” isn’t part of this bounded issue.","The perfect form shouldn’t be made to carry more theology than the discourse supports."],"issue_category":"lexical_semantics","lifecycle_state":"active","scholarly_review_label":"model_assisted_editorial_review","short_note":"John 13:10 uses two Greek verbs. λούω refers to bathing, while νίπτω refers here to washing the feet. Translations that use “wash” for both can hide the contrast.","source_reader_annotation_id":"rap:tan:john.13.10:bathed-versus-washed","source_reference_ids":["source:john.13.10:bathed-versus-washed:greek:1","source:john.13.10:bathed-versus-washed:morphology:2","source:john.13.10:bathed-versus-washed:english:3","source:john.13.10:bathed-versus-washed:lexicon:4","source:john.13.10:bathed-versus-washed:lexicon:5"],"source_study_record_id":"BSL-STUDY-JOHN-13-01-38-001","source_verification_state":"verified","supersedes_revision":1},{"anchors":[{"anchor_id":"anchor:tan:john.13.19:i-am-or-i-am-he:1","anchor_order":1,"anchor_role":"primary","book_id":"john","chapter":13,"expected_phrase":"I am he","scripture_package_content_sha256":"464933e34cf7e1e612da082d1d5c34309cea5e3cecf4657c2eb594f358c211f8","scripture_package_id":"engwebp-2020-2242945d71ca925b","utf16_length":7,"utf16_start":86,"verse":19,"verse_text_sha256":"3de64d10ce82a57ef740856acc8b70696f1af779e4baaad5343e856c6d1c2aea"}],"annotation_issue_id":"tan:john.13.19:i-am-or-i-am-he","annotation_revision":2,"claim_reference_ids":["claim:john.13.19:i-am-or-i-am-he:1","claim:john.13.19:i-am-or-i-am-he:2","claim:john.13.19:i-am-or-i-am-he:3"],"editorial_state":"draft","eligibility":{"evaluation":{"authority_id":"J13-PILOT-01","basis_record_ids":["BSL-STUDY-JOHN-13-01-38-001","rap:tan:john.13.19:i-am-or-i-am-he"],"decision":"requires_review","limitations":["Pending separate evaluation authority, contamination review, and source verification."]},"public_sharing":{"authority_id":"J13-PILOT-01","basis_record_ids":["BSL-STUDY-JOHN-13-01-38-001","rap:tan:john.13.19:i-am-or-i-am-he"],"decision":"requires_review","limitations":["Pending owner approval and rights review of the exact reader prose."]},"reader_delivery":{"authority_id":"J13-PILOT-01","basis_record_ids":["BSL-STUDY-JOHN-13-01-38-001","rap:tan:john.13.19:i-am-or-i-am-he"],"decision":"requires_review","limitations":["Pending owner approval, Lab source and rights verification, and Biblos package compilation."]},"retrieval":{"authority_id":"J13-PILOT-01","basis_record_ids":["BSL-STUDY-JOHN-13-01-38-001","rap:tan:john.13.19:i-am-or-i-am-he"],"decision":"requires_review","limitations":["Pending owner approval and Lab verification of claim and source assertions."]},"training":{"authority_id":"UP-01-A01","basis_record_ids":["BSL-STUDY-JOHN-13-01-38-001","rap:tan:john.13.19:i-am-or-i-am-he"],"decision":"disallowed","limitations":["Training is disallowed by default. Separate owner, rights, source, and training authority would be required."]}},"full_note_paragraphs":["The Greek clause ends ὅτι ἐγώ εἰμι. There is no separate Greek word corresponding to the English pronoun “he.”","English often supplies “he” because “that I am” sounds incomplete. The addition clarifies the immediate claim that Jesus is the one he has said he is.","Leaving the phrase as “I am” makes John’s repeated wor